{
  "file_info": {
    "file_name": "BULLETIN DE SALAIRE-BULLETINS-2024 03 MICHALET MORGAN-1231-2024.PDF",
    "file_size": "9.3 KB",
    "extraction_date": "2025-07-29T01:38:58.132393",
    "file_path": "/Users/maximejulien/Library/CloudStorage/OneDrive-FHB/Documents/Perso/testBS/bulletinsàextraire/BULLETIN DE SALAIRE-BULLETINS-2024 03 MICHALET MORGAN-1231-2024.PDF"
  },
  "employer_info": {
    "company_name": "CENTRE DE SANTE SANTOS DUMONT",
    "address_line1": "SANTOS DUMONT\nBULLETIN DE SALAIRE",
    "postal_code": "77025",
    "city": "RUE SANTOS DUMONT\nBULLETIN DE SALAIRE",
    "siret": "87903653100017",
    "naf_code": "8690F",
    "urssaf_number": "287000001921280655RJ",
    "phone": "8790365310"
  },
  "employee_info": {
    "full_name": "MORGAN MICHALET",
    "title": "Madame",
    "matricule": "00027",
    "social_security": "291069720980802",
    "address_line1": "276277025\nRUE SANTOS DUMONT\nBULLETIN DE SALAIRE",
    "address_line2": "29",
    "postal_code": "27000",
    "city": "EVREUX"
  },
  "employment_details": {
    "job_title": "CHIRURGIEN-DENTISTE\nMadame MORGAN MICHALET",
    "start_date": "06/10/2022",
    "seniority": "1 an et 5 mois"
  },
  "pay_period": {
    "period": "Mars 2024",
    "month": "Mars",
    "year": "2024"
  },
  "salary_elements": {
    "base_salary": "",
    "variable_pay": "10",
    "gross_salary": "10224.00",
    "net_before_tax": "7901.04",
    "net_paid": "7142.72",
    "social_net": "7901.04"
  },
  "social_charges": {
    "health_insurance_employee": "10224.00",
    "health_insurance_employer": "10224.00",
    "solidarity_contribution": "10224.00",
    "pension_uncapped": "10224.00",
    "pension_capped": "3864.00",
    "family_allowances": "10224.00",
    "work_accident": "10224.00",
    "unemployment_insurance": "10224.00",
    "ags": "10224.00"
  },
  "taxes": {
    "income_tax": "7901.04",
    "income_tax_rate": "591.59",
    "annual_tax_cumul": "591.59",
    "csg_deductible": "10413.83",
    "csg_non_deductible": "10.",
    "salary_tax_normal": "10592.75",
    "salary_tax_major1": "745.92",
    "salary_tax_major2": ""
  },
  "deductions": {
    "total_deductible": "20020.96",
    "total_non_deductible": "302.00",
    "total_deductions": "20020.96"
  },
  "contributions": {
    "retirement_tu1": "3864.00",
    "retirement_tu2": "6360.00",
    "equilibrium_general_tu1": "864.00",
    "equilibrium_general_tu2": "6360.00",
    "equilibrium_technical_tu1": "864.00",
    "equilibrium_technical_tu2": "360.00",
    "apec_tra": "864.00",
    "apec_trb": "360.00",
    "provident_fund": "3864.00",
    "mutual_insurance": "39.56",
    "professional_training": "10",
    "apprenticeship_tax": "10"
  },
  "leave_info": {
    "acquired_leave_n_minus_1": "",
    "taken_leave_n_minus_1": "",
    "remaining_leave": ""
  },
  "totals": {
    "ss_ceiling_monthly": "1",
    "taxable_net": "1",
    "employer_charges": "1",
    "global_cost": "1",
    "total_paid": "1"
  },
  "annual_data": {
    "annual_gross": "1",
    "annual_ss_ceiling": "276277025",
    "annual_taxable": ""
  },
  "legal_info": {
    "labor_code": "Art L 3141-3 à L. 3141-20 & L 3164-9 L 1237-1,L 1234-1 & L 1234-2 L 1237-5 à 1237-10\nEléme",
    "conservation_notice": "Conservez ce bulletin sans limitation de durée"
  },
  "payment_info": {
    "payment_date": "31/03/2024",
    "payment_method": "Chèque"
  },
  "raw_text": "CENTRE DE SANTE SANTOS DUMONT\n276277025\nRUE SANTOS DUMONT\nBULLETIN DE SALAIRE\n27930 GUICHAINVILLE\nPériode Mars 2024\nSiret 87903653100017 Code Naf: 8690F\nUrssaf/Msa : 287000001921280655RJ\nMatricule: 00027\nNo SS: 291069720980802\nEmploi - CHIRURGIEN-DENTISTE\nMadame MORGAN MICHALET\n29 AVENUE DU MARECHAL FOCH\nAPPT 29\n27000 EVREUX\nEntrée : 06/10/2022\nAncienneté - 1 an et 5 mois 06/10/2022\nCode de Travail : Art L 3141-3 à L. 3141-20 & L 3164-9 L 1237-1,L 1234-1 & L 1234-2 L 1237-5 à 1237-10\nEléments de paie\nBase\nTaux A déduire A payer\nCharges patronales\nSalaire de base\nRémunération variable (dont CP)\n10: 224.00\nSalaire brut\n10 224.00\nMaladie maternité invalidité décès\n10 224.00 7.0000 715.68\nContribution Solidarité Autonomie\n10 224.00 0.3000 30.67\nVieillesse déplafonnée\n10 224.00 0.4000\n40.90\n10 224.00 2.0200 206.52\nVieillesse plafonnée\n3 864.00 6.9000\n266.62\n3 864.00 8.5500 330.37\nAllocations familiales\n10 224.00 3.4500 352.73\nAccident du travail\n10 224.00 1.2000 122.69\nFNAL plafonné\n3 864.00 0.1000 3.86\nCSG déductible\n10 413.83 6.8000\n708.14\nCSG: non déductible et CRDS\n10. 413.83 2.9000\n302.00\nAssurance chômage TrA+TrB\n10 224.00 4.0500 414.07\nAGS\n10 224.00 0.2000 20.45\nRetraite TU1\n3 864.00 3.1500\n121.72\n3 864.00 4.7200 182.38\nRetraite TU2\n6 360.00 8.6400\n549.50\n360.00 12.9500 823.62\nContribution d'Equilibre Général TU1\n864.00 0.8600\n33.23\n864.00 1.2900 49.85\nContribution d'Equilibre Général TU2\n6 360.00 1.0800\n68.69\n360.00 1.6200 103.03\nContribution d'Equilibre Technique TU1\n864.00 0.1400\n5.41\n864.00 0.2100 8.11\nContribution d'Equilibre Technique TU2\n360.00 0.1400\n8.90\n360.00 0.2100 13.36\nAPEC TrA\n864.00 0.0240\n0.93\n3 864.00 0.0360\n1.39\nAPEC TrB\n360.00 0.0240\n1.53\n360.00 0.0360 2.29\nAllocations familiales (complément)\n21 461.11 1.8000 386.30\nMaladie (complément)\n10 224.00 6.0000 613.44\nContribution au dialogue social\n10 224.00 0.0160\n1.64\nPrévoyance décès cadre\n3 864.00 1.5000 57.96\nPrévoyance cadre TrA\n3 864.00 1.0200\n39.41\n3 864.00 1.0200 39.41\nPrévoyance cadre TrB\n360.00 2.1450\n136.42\n6 360.00 3.6450 231.82\nMutuelle\n39.56\n39.56\nContribution formation prof. (légal)\n10: 224.00 0.5500 56.23\nTaxe d'apprentissage\n10: 224.00 0.5900 60.32\nTaxe d'apprentissage (Libératoire)\n10: 224.00 0.0900 9.20\nTaxe sur les salaires taux normal\n10 592.75 4.2500 450.19\nTaxe sur les salaires ler taux majoré\n745.92 4.2500 31.70\nTaxe: sur les salaires 2e taux majoré\n9 098.08 9.3500 850.67\nTotal des retenues déductibles\n20 020.96\nTotal des retenues non déductibles\n302.00\nTotal des retenues\n2322.96\n6209.51\nRéintégration fiscale\n39.56\nMontant net social\n7901.04\nNet à payer avant impôt sur le revenu\n7 901.04\ndont évolution de lai rémunération liée àl la\nsuppression des cotisations chômage eti maladie\n145.02\nBrut\nPlafond S.S. Net imposable Ch. patronales Coût Global Total versé\nMensuel\nAnnuel\nCongés N-1 Congés N\nAcquis\nPris\nSolde\nDans votre intérêt, et pour vous aider à faire valoir vos droits, conservez ce bulletin de paie: sans limitation de durée. Informations complémentaires www.service-public.fr\nCENTRE DE SANTE SANTOS DUMONT\n276277025\nRUE SANTOS DUMONT\nBULLETIN DE SALAIRE\n27930 GUICHAINVILLE\nPériode Mars 2024\nSiret 87903653100017 Code Naf: 8690F\nUrssaf/Msa : 287000001921280655RJ\nMatricule: 00027\nNo SS: 291069720980802\nEmploi - CHIRURGIEN-DENTISTE\nMadame MORGAN MICHALET\n29 AVENUE DU MARECHAL FOCH\nAPPT 29\n27000 EVREUX\nEntrée : 06/10/2022\nAncienneté: - 1 an et 5 mois 06/10/2022\nCode de Travail : Art L 3141-3 à L. 3141-20 & L 3164-9 L 1237-1,L 1234-1 & L 1234-2 L 1237-5 à 1237-10\nEléments de paie\nBase\nTaux A déduire A payer\nCharges patronales\nImpôt: surl ler revenu prélevé àl la source PAS\n8 242.60 -9.2000\n758.32\nTaux personnalisé\nImpôt surl ler revenu : cumul PAS annuel\n591.59\nNet payé\n7142.72\nBrut\nPlafond S.S. Neti imposable Ch. patronales Coût Global Total versé\nMensuel\n10: 224.00\n3864.00\n8242.60\n6209.51\n16. 433.51\n16 433.51\nAnnuel\n21 461.10\n11 592.00\n171 299.93\n12. 511.55\n33 972.65\n33 972.65\nCongés N-1 Congés N\nAcquis\n20.00\n25.00\nNet\n7 142.72 euros\nPris\n:\n20.00\n47.00\npayé\nSolde\n22.00\nPaiement le 31/03/2024 par Chèque\nDans votre intérêt, et pour vous aider à faire valoir vos droits, conservez ce bulletin de paie: sans limitation de durée. Informations complémentaires www.service-public.fr\n"
}